{"actionable":false,"adapter_hash":"4925FDA816CDC529A70E850850C898033C2C593DCDF2940803C0815B63B9B508","adapter_version":"P1008_T1_DERIVED_KPI_ADAPTER_V1","checks":["INPUT_CONTRACT_PASS","T1_ONLY_PASS","LINEAGE_ANCESTRY_PASS","PERIOD_UNIT_DENOMINATOR_PASS","NO_ASSUMPTION_PROXY_CARRY_OR_IMPUTATION_PASS","DETERMINISTIC_RECOMPUTATION_PASS","NON_ACTIONABLE_NON_PUBLICATION_PASS"],"created_at":"2026-09-27T00:00:00Z","eligibility_gate":"T1_EXACT_DERIVED_ONLY","formal_authority":false,"governed_rounding_rule":"DECIMAL_HALF_UP_3DP","publication":false,"recomputed_value":"2.000","schema_version":"P1008_T1_VALIDATION_RECEIPT_V1","source_candidate_hash":"609C61B6D6F3E57CA80925626C1CA09C096B0CC7F0E93F416DE9DD0FD28EBFAF","source_candidate_id":"TEST-ONLY-PB-2026-09-18-V1","validation_receipt_id":"T1VR-609C61B6D6F3E57C-4925FDA816CD","validation_status":"PASS"}
